{
  "metadata": {
    "registry_id": "AETHER_PROTOCOL_GOVERNANCE",
    "schema_version": "2.0.0",
    "last_updated": "2026-02-17",
    "owners": [
      "core-architecture",
      "platform-integration",
      "infra-ci"
    ],
    "tracks": [
      "P",
      "X"
    ],
    "phase_span": {
      "min": 0,
      "max": 14
    },
    "long_lived_integration_branch": "codex/core-cpp-migration"
  },
  "contracts": [
    {
      "id": "C-TRACK-P-LEGAL-BASELINE",
      "title": "Track P parity is legal baseline",
      "status": "active",
      "track": "P",
      "type": "invariant",
      "phase_scope": [
        0,
        1,
        2,
        3,
        4,
        5
      ],
      "normative_sources": [
        {
          "path": "CURSOR_MEGA_PROMPT_V2.md",
          "line": 952
        }
      ],
      "enforced_by_gate_ids": [
        "G-CONTRACT-VALIDATOR",
        "G-FIXTURE-BASELINE"
      ]
    },
    {
      "id": "C-TRACK-X-FEATURE-ISOLATION",
      "title": "Track X feature flags must not pollute Track P",
      "status": "active",
      "track": "X",
      "type": "invariant",
      "phase_scope": [
        6,
        7,
        8,
        9,
        10,
        11,
        12,
        13,
        14
      ],
      "normative_sources": [
        {
          "path": "CURSOR_MEGA_PROMPT_V2.md",
          "line": 969
        }
      ],
      "enforced_by_gate_ids": [
        "G-FLAG-DEFAULT-OFF",
        "G-CONTRACT-VALIDATOR"
      ]
    },
    {
      "id": "C-CORE-SYSTEM-BOUNDARY-PIXEL",
      "title": "Pixel analysis remains in System layer unless explicitly re-scoped",
      "status": "blocked",
      "track": "PX",
      "type": "boundary",
      "phase_scope": [
        0,
        1,
        2,
        3,
        4,
        5,
        8,
        9,
        10
      ],
      "normative_sources": [
        {
          "path": "CURSOR_MEGA_PROMPT_V2.md",
          "line": 171
        },
        {
          "path": "CURSOR_MEGA_PROMPT_V2.md",
          "line": 15781
        }
      ],
      "enforced_by_gate_ids": [
        "G-CONTRACT-VALIDATOR"
      ]
    },
    {
      "id": "C-BLUR-SSOT-SINGLE-VALUE",
      "title": "Blur-related SSOT must be singular and conflict-free",
      "status": "active",
      "track": "P",
      "type": "constant",
      "phase_scope": [
        0,
        5
      ],
      "normative_sources": [
        {
          "path": "CURSOR_MEGA_PROMPT_V2.md",
          "line": 543
        },
        {
          "path": "CURSOR_MEGA_PROMPT_V2.md",
          "line": 573
        }
      ],
      "enforced_by_gate_ids": [
        "G-BLUR-CONSTANT-DRIFT"
      ]
    },
    {
      "id": "C-SCAN-PATCHDISPLAY-MIGRATION",
      "title": "ScanViewModel must use PatchDisplayMap instead of local displaySnapshot dict",
      "status": "active",
      "track": "P",
      "type": "procedure",
      "phase_scope": [
        5
      ],
      "normative_sources": [
        {
          "path": "CURSOR_MEGA_PROMPT_V2.md",
          "line": 779
        }
      ],
      "enforced_by_gate_ids": [
        "G-SCAN-GUIDANCE-INTEGRATION",
        "G-CONTRACT-VALIDATOR"
      ]
    },
    {
      "id": "C-SCAN-BLUR-HAPTIC-REMOVAL",
      "title": "Blur haptic in ScanViewModel is removed; blur only gates frame rejection",
      "status": "active",
      "track": "P",
      "type": "procedure",
      "phase_scope": [
        5
      ],
      "normative_sources": [
        {
          "path": "CURSOR_MEGA_PROMPT_V2.md",
          "line": 790
        }
      ],
      "enforced_by_gate_ids": [
        "G-SCAN-GUIDANCE-INTEGRATION",
        "G-CONTRACT-VALIDATOR"
      ]
    },
    {
      "id": "C-PHASE-ORDERING-LAW",
      "title": "Phase ordering is mandatory",
      "status": "active",
      "track": "PX",
      "type": "gate",
      "phase_scope": [
        0,
        1,
        2,
        3,
        4,
        5,
        6,
        7,
        8,
        9,
        10,
        11,
        12,
        13,
        14
      ],
      "normative_sources": [
        {
          "path": "CURSOR_MEGA_PROMPT_V2.md",
          "line": 14329
        }
      ],
      "enforced_by_gate_ids": [
        "G-PHASE-ORDER",
        "G-CONTRACT-VALIDATOR"
      ]
    },
    {
      "id": "C-EXACT-PIPELINE-IO-CLOSED",
      "title": "EXACT-ONLY pipeline IO closed sets are inviolable",
      "status": "active",
      "track": "PX",
      "type": "invariant",
      "phase_scope": [
        0,
        1,
        2,
        3,
        4,
        5
      ],
      "normative_sources": [
        {
          "path": "CURSOR_MEGA_PROMPT_V2.md",
          "line": 15091
        }
      ],
      "enforced_by_gate_ids": [
        "G-CONTRACT-VALIDATOR"
      ]
    },
    {
      "id": "C-PIT1-TIMEWARP-PURITY",
      "title": "PresentLoop timewarp is pure reprojection with constant disocclusion fill",
      "status": "active",
      "track": "P",
      "type": "invariant",
      "phase_scope": [
        4
      ],
      "normative_sources": [
        {
          "path": "CURSOR_MEGA_PROMPT_V2.md",
          "line": 15349
        },
        {
          "path": "CURSOR_MEGA_PROMPT_V2.md",
          "line": 47047
        }
      ],
      "enforced_by_gate_ids": [
        "G-CONTRACT-VALIDATOR"
      ]
    },
    {
      "id": "C-AUDIT-ANCHOR-CLIENT-FIRST",
      "title": "RFC3161 audit anchoring is client-first with start/end mandatory and 60s periodic anchors",
      "status": "active",
      "track": "PX",
      "type": "security",
      "phase_scope": [
        4,
        13
      ],
      "normative_sources": [
        {
          "path": "CURSOR_MEGA_PROMPT_V2.md",
          "line": 50281
        },
        {
          "path": "CURSOR_MEGA_PROMPT_V2.md",
          "line": 50286
        }
      ],
      "enforced_by_gate_ids": [
        "G-AUDIT-ANCHOR-CLIENT-FIRST",
        "G-CONTRACT-VALIDATOR"
      ]
    },
    {
      "id": "C-AETHERBILLING-RESOURCE-WALLET",
      "title": "Resource Wallet metering and quota charging algorithm is delivered in Phase 4 infrastructure",
      "status": "active",
      "track": "P",
      "type": "economic",
      "phase_scope": [
        4
      ],
      "normative_sources": [
        {
          "path": "CURSOR_MEGA_PROMPT_V2.md",
          "line": 41200
        },
        {
          "path": "CURSOR_MEGA_PROMPT_V2.md",
          "line": 41326
        }
      ],
      "enforced_by_gate_ids": [
        "G-CONTRACT-VALIDATOR",
        "G-SWIFT-BUILD"
      ]
    },
    {
      "id": "C-COSTSHIELD-POLICYKERNEL-DETERMINISM",
      "title": "CostShield quota, rate-limit, and shadow-pricing policy kernel is deterministic Core logic in Phase 4",
      "status": "active",
      "track": "P",
      "type": "security",
      "phase_scope": [
        4
      ],
      "normative_sources": [
        {
          "path": "CURSOR_MEGA_PROMPT_V2.md",
          "line": 48180
        },
        {
          "path": "CURSOR_MEGA_PROMPT_V2.md",
          "line": 48816
        }
      ],
      "enforced_by_gate_ids": [
        "G-CONTRACT-VALIDATOR",
        "G-SWIFT-BUILD"
      ]
    },
    {
      "id": "C-COSTSHIELD-SERVER-ENFORCEMENT",
      "title": "Auth, gateway rate limiting, idempotency, and runtime budget fuse are enforced server-side from Phase 7+",
      "status": "active",
      "track": "X",
      "type": "security",
      "phase_scope": [
        7,
        8,
        9,
        10,
        11,
        12,
        13
      ],
      "normative_sources": [
        {
          "path": "CURSOR_MEGA_PROMPT_V2.md",
          "line": 48545
        },
        {
          "path": "CURSOR_MEGA_PROMPT_V2.md",
          "line": 48816
        }
      ],
      "enforced_by_gate_ids": [
        "G-CONTRACT-VALIDATOR",
        "G-PHASE13-E2E-SMOKE"
      ]
    },
    {
      "id": "C-PIT2-VOLUME-GATING",
      "title": "Watertight result gates measured volume",
      "status": "active",
      "track": "P",
      "type": "invariant",
      "phase_scope": [
        1
      ],
      "normative_sources": [
        {
          "path": "CURSOR_MEGA_PROMPT_V2.md",
          "line": 15471
        }
      ],
      "enforced_by_gate_ids": [
        "G-CONTRACT-VALIDATOR"
      ]
    },
    {
      "id": "C-UPLOAD-CHUNK-HASH-VERIFY",
      "title": "persist_chunk must verify expected_hash before durable write",
      "status": "active",
      "track": "P",
      "type": "security",
      "phase_scope": [
        5
      ],
      "normative_sources": [
        {
          "path": "server/app/services/upload_service.py",
          "line": 287
        },
        {
          "path": "server/tests/test_upload_service.py",
          "line": 90
        }
      ],
      "enforced_by_gate_ids": [
        "G-UPLOAD-CHUNK-HASH",
        "G-CONTRACT-VALIDATOR"
      ]
    },
    {
      "id": "C-FIXTURE-PHASE0-MANDATORY",
      "title": "Phase 0 golden fixtures must pass before any Track P migration",
      "status": "active",
      "track": "P",
      "type": "gate",
      "phase_scope": [
        0
      ],
      "normative_sources": [
        {
          "path": "CURSOR_MEGA_PROMPT_V2.md",
          "line": 1651
        },
        {
          "path": "CURSOR_MEGA_PROMPT_V2.md",
          "line": 7904
        }
      ],
      "enforced_by_gate_ids": [
        "G-FIXTURE-BASELINE"
      ]
    },
    {
      "id": "C-FEATURE-FLAG-DEFAULTS",
      "title": "Track X feature flags default OFF",
      "status": "active",
      "track": "X",
      "type": "feature_flag",
      "phase_scope": [
        6,
        7,
        8,
        9,
        10,
        11,
        12,
        13,
        14
      ],
      "normative_sources": [
        {
          "path": "CURSOR_MEGA_PROMPT_V2.md",
          "line": 970
        },
        {
          "path": "CURSOR_MEGA_PROMPT_V2.md",
          "line": 18562
        }
      ],
      "enforced_by_gate_ids": [
        "G-FLAG-DEFAULT-OFF"
      ]
    },
    {
      "id": "C-FEATURE-FLAG-NAMESPACE",